"Paper Title","Paper Link","Publication Year","Publication Type","Publication Title","Author Names","DOI","PDF Link","Abstract","Relevant Excerpt"
"Artificial Intelligence: New breakthrough for Diabetes Mellitus and Regulatory Perspective","https://scispace.com/paper/artificial-intelligence-new-breakthrough-for-diabetes-2mnwm4h1","2022","Journal Article","International journal of pharmaceutical sciences review and research","Shivali Rahi
Viney Lather
Arpana Rana","10.47583/ijpsrr.2022.v77i02.018","https://scispace.com/pdf/artificial-intelligence-new-breakthrough-for-diabetes-2mnwm4h1.pdf","Artificial intelligence (AI) is a rapidly evolving science and its application to diabetes has the potential to transform the approach for the diagnosis and treatment of the disease. The inclusion of AI with smart devices, such as medical devices, wearables, smartphones, and sensor technology, will allow for the building of digital machines capable of supervising and monitoring people with diabetes continuously. The new digital technologies, big data-based analytics, and the application of AI to diabetes data will revolutionize the way diabetes and diabetes related complications are treated, as well as their prevention and control. The artificial intelligence is putting considerable effort into developing support systems for patient use, which automatically analyze the patient’s data c ollected by sensors and other portable devices that offer tailored recommendations for therapy adjustments to patients. Patients are increasingly being empowered for self-management of diabetes and both patients and healthcare professionals are benefitting from clinical decision support. It is anticipated that predictive overall performance of AI will soon be maximized by a large amount of organized data and plentiful computational resources. The objectives of this article are to enlist the advancements w.r.t. artificial intelligence in the field of diabetes management using smart devices. Artificial Intelligence is a promising area of research that can significantly improve the quality of life for people affected by this disease. Leading medical device makers as well as technology giants are constantly innovating to bring novel products and solutions to the market.","involving the integration of multiple components with many unique design and development challenges. Due to the sophistication of softwarecontrolled technologies for diabetes management, regulatory authorities are increasingly focused on the ability of patients and healthcare professionals to operate these devices safely and with optimum effectiveness. CONCLUSION:
 The technological advancements, coupled with increasing influx of new products into the market, are expected to propel the growth of global diabetes care devices market over the forecast period. The need for accurate, personalized, and evidence-based care solutions is driving constant new trends and developments in the digital diabetes management industry. CONCLUSION:
 The current research in diabetes is putting considerable effort into developing decision support systems for patient use. Artificial intelligence enables patients with diabetes to make daily decisions about diet and intensity of activities. CONCLUSION:
 Researchers had designed a reinforcement learning algorithm-based system that aims to personalize messages for each patient's situation in order to better encourage them to automate their treatment. These advances save time and cost as data can be collected remotely and virtual management is replacing the routine visits to a clinic. International Journal of Pharmaceutical Sciences Review and Research:
 We are finally on the point of lessening the enormous daily load encountered by millions of individuals with diabetes by utilising the ability of artificial intelligence to find patterns from insulin dosage data for the purpose of decision assistance. International Journal of Pharmaceutical Sciences Review and Research:
 It is crucial to modernize the laws or rules for the device developers to draw well-understood connections between lifestyle including exercise and diet and the management of diabetes."
"From big data to better patient outcomes","https://scispace.com/paper/from-big-data-to-better-patient-outcomes-2caq5dcj","2022","Journal Article","Clinical chemistry and laboratory medicine","Tim Hulsen
David Friedecký
Harald Renz
Els Melis
Pieter Vermeersch
Pilar Fernandez-Calle","10.1515/cclm-2022-1096","https://scispace.com/pdf/from-big-data-to-better-patient-outcomes-2caq5dcj.pdf","Abstract Among medical specialties, laboratory medicine is the largest producer of structured data and must play a crucial role for the efficient and safe implementation of big data and artificial intelligence in healthcare. The area of personalized therapies and precision medicine has now arrived, with huge data sets not only used for experimental and research approaches, but also in the “real world”. Analysis of real world data requires development of legal, procedural and technical infrastructure. The integration of all clinical data sets for any given patient is important and necessary in order to develop a patient-centered treatment approach. Data-driven research comes with its own challenges and solutions. The Findability, Accessibility, Interoperability, and Reusability (FAIR) Guiding Principles provide guidelines to make data findable, accessible, interoperable and reusable to the research community. Federated learning, standards and ontologies are useful to improve robustness of artificial intelligence algorithms working on big data and to increase trust in these algorithms. When dealing with big data, the univariate statistical approach changes to multivariate statistical methods significantly shifting the potential of big data. Combining multiple omics gives previously unsuspected information and provides understanding of scientific questions, an approach which is also called the systems biology approach. Big data and artificial intelligence also offer opportunities for laboratories and the In Vitro Diagnostic industry to optimize the productivity of the laboratory, the quality of laboratory results and ultimately patient outcomes, through tools such as predictive maintenance and “moving average” based on the aggregate of patient results.","Authors: Tim Hulsen,David Friedecký,Harald Renz,Els Melis,Pieter Vermeersch,Pilar Fernandez-Calle Keywords: artificial intelligence, big data, data science, patient outcomes, personalized healthcare, precision medicine"
"Applications of Artificial Intelligence in Medicine","https://scispace.com/paper/applications-of-artificial-intelligence-in-medicine-2enx3558ei","2023","Journal Article","Exploratory research and hypothesis in medicine","Ruby Srivastava","10.14218/erhm.2023.00048","https://scispace.compdf/applications-of-artificial-intelligence-in-medicine-2enx3558ei.pdf","Artificial intelligence (AI) with machine learning tools are used to search, store, and analyze medical data to benefit both physicians and the health of patients in various ways.With the advancement in machine learning algorithms and bioinformatics techniques, AI has become an essential part of modern healthcare society.AI algorithms and deep learning applications support clinicians with managing health records, making diagnoses and clinical decisions, prescribing medication, determining mental health, and imaging analysis.Clinicians gain rapid access to information and research relevant to the needs of the patients.As some algorithms compete with and sometimes outperform clinicians, it is necessary to fully integrate this technology into daily medical practices.However, we must recognize the strengths and weaknesses of AI, and obtain the perspectives of experts outside the medical field to enable the inclusion of the ethical, philosophical, sociological, psychological, behavioral, and economical aspects of machine behavior when understanding the evolving interaction of machines with humans, so that it can be used for advantageous purposes.AI technology cannot be considered a replacement for physicians, rather it can act as multiple task-oriented device support to ease the burden on clinicians so that they can provide better care of life to patients at every level. ","that respond to mental issues, interpersonal violence, and health-related questions from mobile phone users allowing patients to seek early care. Methods in existing research findings: A virtual nurse Molly provides follow-up care to discharged patients allowing doctors to focus on more pressing cases. Methods in existing research findings:
 AI has not only benefitted other industries, it has helped physicians to rationalize tasks, improve the efficiency of operations, and simplify complex procedures. Major Companies such as Microsoft invested $40 million over five years of funding in 2020 for innovations in healthcare industries. Methods in existing research findings:
 Undoubtedly, AI has begun changing the healthcare industry with AI expansion taking place throughout the healthcare sector, and, as such, questions about the supremacy and restrictions of this technology have become ever more relevant. Results of these findings:
 AI is having a major effect on every aspect of primary and advanced health care. AI-enabled computer applications help caregivers in primary health care to better diagnose patients and provide precision protocols for each individual. Results of these findings:
 AI applications also facilitate the storage and analysis of patient information on EHR systems presenting it to the physician along with a sound understanding of patient's medical needs in less time. Results of these findings:
 This is saving physicians a great deal of time previously spent on deskwork and EHR systems giving them more time for physical presence with their patients. Results of these findings:
 AI has not only reduced the amount of physicians' deskwork and freed up their time for primary healthcare but also increased ingenuity, accuracy, and efficacy. Results of these findings:
 AI is also being used to find and develop new drugs and investigate the repurposing of existing drugs for use against specific diseases, as clinical trials are costly and time-consuming. AI is facilitating ""precision medicine"" as it can screen existing medications and suggest treatment targeted at individual patients. Results of these findings:
 AI can outperform dermatologists in classifying skin diseases accurately AI systems can learn from successive cases and can handle multiple cases efficiently in less time compared to human learning processes. Results of these findings:
 However, in some cases, AI-based decision-making approaches are not in agreement with the expert's opinion, such as identifying pulmonary tuberculosis on chest radiographs. The increased usage of AI technology has also reduced the number of job opportunities, which is a major concern for the health industry. Results of these findings:
 In addition, although human behavior can be translated by analytical and logical algorithms, it is difficult for machines to translate human attributes such as the ability to conceptualize, interactive and communication skills, sensitive intelligence, and creativity. Moreover, AI predictions are not always accurate. Results of these findings:
 In a study, 640,000 digital mammograms were reviewed in the Digital Mammography DREAM challenge with the help of several high-end processing computers. Results of these findings:
 The observed results were approximately equal to those of the bottom 10% of radiologists with a specificity of 0.81, sensitivity of 0.80, and area under the receiver operator curve (ROC) of 0.87. Results of these findings:
 It is evident, however, that AI will play a major role in the healthcare industry in the future and thus it is essential to train medical staff regarding its concepts and applicability. AI functions efficiently in a technology-based workspace to cultivate soft skills such as empathy in machines."
"Utilization of Artificial Intelligence in Disease Prevention: Diagnosis, Treatment, and Implications for the Healthcare Workforce","https://scispace.com/paper/utilization-of-artificial-intelligence-in-disease-prevention-2cxqjpdt","2022","Journal Article","Healthcare","Shahid Ud Din Wani
Nisar Ahmad Khan
Gaurav Thakur
Surya Prakash Gautam
Mohammad Ali
Prawez Alam
Sultan Alshehri
Mohamed M. Ghoneim
Faiyaz Shakeel","10.3390/healthcare10040608","https://scispace.com/pdf/utilization-of-artificial-intelligence-in-disease-prevention-2cxqjpdt.pdf","","obtain such data, and any erroneous information can be fatal . Erroneous information has negative implications for catastrophe preparedness and response. The actual crowd is represented by the data collected from multiple sources, which includes both purposeful and unintentional misleading data . Conclusions:
 We believe that AI will play a significant role in the healthcare industry. Precision medicine, which is widely known for much improvement in healthcare, is fueled by this capability. Though early attempts at diagnosis and therapy guidance proved challenging, we expect that AI can now master the domain as well. Thanks to significant improvements in AI for imaging science, many radiology and pathology images are projected to be evaluated by a device at some point. Voice and text analytics are increasingly used for tasks such as patient communication and diagnostic report collection, and this pattern is expected to continue. The most challenging challenge for AI in such health domains is maintaining its acceptance in ordinary clinical practice, rather than whether the technologies are competent enough to be effective. AI programs should be licensed by governing bodies, capable of EHR systems, standardized to the point that identical devices function in the same way, trained by physicians, financed by either public or commercial payers, and modified in the long run in the sector for universal acceptance to occur. These obstacles will be solved in the end, but they will require even more than that for the maturation of the technology itself. As a result, within the next five years, we expect to see minimal AI application in clinical practice, with more widespread use by the next decade. It can increase the productivity and efficiency of care delivery and allow healthcare systems to provide more and better care for more people. Compared to previously reported articles on AI, this review focused on the applications of AI in healthcare systems especially in the diagnosis and treatment of infectious diseases (Table ). Based on the summarized data, it has been inferred that the AI can help in improving the knowledge of healthcare workers, enabling them to spend more time in direct patient care and reduce fatigue. Overall, we might conclude that the future of 'traditional medicine' may be closer than we think, with patients first seeing a computer and then a doctor."
"Assessing the Performance of Artificial Intelligence Systems for the Screening of Diabetic Retinopathy: A Systematic Review and Meta-Analysis","https://scispace.com/paper/assessing-the-performance-of-artificial-intelligence-systems-3ycnidu6q8","2021","Posted Content","","Ryan Sadjadi","10.20944/PREPRINTS202108.0030.V1","https://scispace.com/pdf/assessing-the-performance-of-artificial-intelligence-systems-3ycnidu6q8.pdf","Diabetic retinopathy is the most common microvascular complication of diabetes mellitus and one of the leading causes of blindness globally. Due to the progressive nature of the disease, earlier detection and timely treatment can lead to substantial reductions in the incidence of irreversible vision-loss. Artificial intelligence (AI) screening systems have offered clinically acceptable and quicker results in detecting diabetic retinopathy from retinal fundus and optical coherence tomography (OCT) images. Thus, this systematic review and meta-analysis of relevant investigations was performed to document the performance of AI screening systems that were applied to fundus and OCT images of patients from diverse geographic locations including North America, Europe, Africa, Asia, and Australia. A systematic literature search on Medline, Global Health, and PubMed was performed and studies published between October 2015 and January 2020 were included. The search strategy was based on the Preferred Reporting Items for Systematic Reviews and Meta-analyses (PRISMA) reporting guidelines, and AI-based investigations were mandatory for studies inclusion. The abstracts, titles, and full-texts of potentially eligible studies were screened against inclusion and exclusion criteria. Twenty-one studies were included in this systematic review; 18 met inclusion criteria for the meta-analysis. The pooled sensitivity of the evaluated AI screening systems in detecting diabetic retinopathy was 0.93 (95% CI: 0.92-0.94) and the specificity was 0.88 (95% CI: 0.86-0.89). The included studies detailed training and external validation datasets, criteria for diabetic retinopathy case ascertainment, imaging modalities, DR-grading scales, and compared AI results to those of human graders (e.g., ophthalmologists, retinal specialists, trained nurses, and other healthcare providers) as a reference standard. The findings of this study showed that the majority AI screening systems demonstrated clinically acceptable levels of sensitivity and specificity for detecting referable diabetic retinopathy from retinal fundus and OCT photographs. Further improvement depends on the continual development of novel algorithms with large and gradable sets of images for training and validation. If cost-effectiveness ratios can be optimized, AI can become a financially sustainable and clinically effective intervention that can be incorporated into the healthcare systems of low-to-middle income countries (LMICs) and geographically remote locations. Combining screening technologies with treatment interventions such as anti-VEGF therapy, acellular capillary laser treatment, and vitreoretinal surgery can lead to substantial reductions in the incidence of irreversible vision-loss due to proliferative diabetic retinopathy.","studies with regard to participant recruitment. It is unclear whether participant data was included in multiple datasets, so the overall performance metrics may be underestimated or overestimated due to potential changes in said participants' severities of diabetic retinopathy between data sources. Conclusions:
 This review and meta-analysis demonstrates clinically acceptable performances from the majority AI systems used in diabetic retinopathy screening. Although the majority of neural networks showed clinically acceptable performance levels, further improvement depends on the continual development of novel algorithms with large and gradable sets of images for training and validation. With the rapidly growing global burden of diabetic retinopathy, AI screening systems can increase the ability for disease prevention by allowing for early detection. If cost-effectiveness ratios can be optimized, AI can become a financially sustainable and clinically effective intervention that can be incorporated into the healthcare systems of LMICs and geographically remote locations. AI screening can increase the efficiency of eye care and diabetes services and optimize the care of patients within healthcare systems that provide large-scale services on a population level. Combining screening technologies with treatment interventions such as anti-VEGF therapy, acellular capillary laser treatment, and vitreoretinal surgery can lead to substantial reductions in the incidence of irreversible vision-loss due to proliferative diabetic retinopathy. With further advancement, AI will inform and improve primary, secondary, and tertiary care settings' approaches to diabetic retinopathy management."
"Graph Representation Forecasting of Patient's Medical Conditions: Toward a Digital Twin.","https://scispace.com/paper/graph-representation-forecasting-of-patient-s-medical-1yjud2yvhx","2021","Journal Article","Frontiers in Genetics","Pietro Barbiero
Ramón Viñas Torné
Pietro Liò","10.3389/FGENE.2021.652907","https://scispace.com/pdf/graph-representation-forecasting-of-patient-s-medical-1yjud2yvhx.pdf","Objective: Modern medicine needs to shift from a wait and react, curative discipline to a preventative, interdisciplinary science aiming at providing personalized, systemic, and precise treatment plans to patients. To this purpose, we propose a ""digital twin"" of patients modeling the human body as a whole and providing a panoramic view over individuals' conditions. Methods: We propose a general framework that composes advanced artificial intelligence (AI) approaches and integrates mathematical modeling in order to provide a panoramic view over current and future pathophysiological conditions. Our modular architecture is based on a graph neural network (GNN) forecasting clinically relevant endpoints (such as blood pressure) and a generative adversarial network (GAN) providing a proof of concept of transcriptomic integrability. Results: We tested our digital twin model on two simulated clinical case studies combining information at organ, tissue, and cellular level. We provided a panoramic overview over current and future patient's conditions by monitoring and forecasting clinically relevant endpoints representing the evolution of patient's vital parameters using the GNN model. We showed how to use the GAN to generate multi-tissue expression data for blood and lung to find associations between cytokines conditioned on the expression of genes in the renin-angiotensin pathway. Our approach was to detect inflammatory cytokines, which are known to have effects on blood pressure and have previously been associated with SARS-CoV-2 infection (e.g., CXCR6, XCL1, and others). Significance: The graph representation of a computational patient has potential to solve important technological challenges in integrating multiscale computational modeling with AI. We believe that this work represents a step forward toward next-generation devices for precision and predictive medicine.",". This tool could also be complemented by clinical decision support systems such as . The complexly structured and multilevel comorbidity and frailty patterns of most diseases describe a highly dynamical system and are, therefore, challenging current medical therapies. AI for Evidence-Based Medicine:
 From a clinical standpoint, AI will support a plethora of different tasks from medical check up to personalized intervention strategies to contrast ripple effects or to promote healthy habits. In non-acute states, predictive inference will propose prevention plans for comorbidity management, particularly in presence of multiple therapies . Increasingly large amount of personal data will be collected to feed modular machine learning (ML) models organized to address specific and personalized medical issues. Clinical endpoints will be constantly monitored, shared, and compared in order to answer relevant research questions and to deliver the best possible service. A deeper understanding and practice of modeling in medicine will produce better investigation of complex biological processes, and even new ideas and better feedback into medicine. Modelingbased approaches combined with data-driven ML techniques will progressively provide models with higher degree of interpretability and generalization ability , which will make evidence-based medicine even more accessible intensifying the involvement of patients in the decision-making process. AI simulations forecasting the evolution of clinical endpoints over time will also reshape clinical guidelines , which will no longer be based just on horizontal population studies. Cross-modality data will be collected for each patient and machine learning models will be used to predict a bundle of possible trajectories representing the future states of the patient allowing for personalized prescriptions, surgical planning, and medical interventions. Social Impact:
 Ethical repercussions will also be huge . The transition will call for deeper transdisciplinary research and a substantial technological innovation in a variety of research and social areas. Here, education will play a key role in changing lifestyle habits and the way health is perceived, communicated, and delivered . For each individual, both healthcare systems and private companies will collect, save, and eventually exploit an enormous amount of personal data. Providing an effective, stable, and unified juridical overview is critical on this matter . Social Impact:
 4.2.6. Next-Generation Medical Devices AI will change the leading vehicle of medicine. The demand for AI-powered and internet of things (IoT) devices is increasing worldwide. The future equipment for precision medicine will likely required to be cheap and extremely modular, but more importantly it needs to be deployable in dedicated hardware to be distributed in larger markets. Our digital twin model aims at providing the first example of a novel class of AI-assisted tools for precision and predictive medicine. Our framework is designed to scale to medical device deployment and run time monitoring and verification combining ideas from systems medicine with scientific computing and machine learning. The integration of interpretable AI models in clinical devices may lead to a deep transformation in healthcare paving the way for a next generation of tools for precision medicine probing the inner workings of full body in well-being and disease conditions."
