"Paper Title","Paper Link","Publication Year","Publication Type","Publication Title","Author Names","DOI","PDF Link","Abstract","Relevant Excerpt"
"A Review on Explainable Artificial Intelligence for Healthcare: Why, How, and When?","https://scispace.com/paper/a-review-on-explainable-artificial-intelligence-for-13qpycks","2023","Journal Article","IEEE transactions on artificial intelligence","Subrato Bharati
M. Rubaiyat Hossain Mondal
Prajoy Podder","10.1109/TAI.2023.3266418","https://scispace.compdf/a-review-on-explainable-artificial-intelligence-for-13qpycks.pdf","Artificial intelligence (AI) models are increasingly finding applications in the field of medicine. Concerns have been raised about the explainability of the decisions that are made by these AI models. In this article, we give a systematic analysis of explainable artificial intelligence (XAI), with a primary focus on models that are currently being used in the field of healthcare. The literature search is conducted following the preferred reporting items for systematic reviews and meta-analyses (PRISMA) standards for relevant work published from 1 January 2012 to 02 February 2022. The review analyzes the prevailing trends in XAI and lays out the major directions in which research is headed. We investigate the why, how, and when of the uses of these XAI models and their implications. We present a comprehensive examination of XAI methodologies as well as an explanation of how a trustworthy AI can be derived from describing AI models for healthcare fields. The discussion of this work will contribute to the formalization of the XAI field.","Authors: M Rubaiyat,Hossain Mondal,Prajoy Podder,Subrato Bharati Keywords: Explainable Artificial Intelligence, healthcare, deep learning, medical care, medicine, medical imaging I. INTRODUCTION:
 dvances in Artificial Intelligence (AI) have taken place in recent years, with the technology becoming more complicated, more autonomous, and more sophisticated. As data grows exponentially, so does the speed at which computer power advances. This combination gives a massive boost to the development of AI. I. INTRODUCTION:
 People's lives have already been impacted by AI's practical accomplishments in a range of fields (e.g., voice recognition, self-driving cars, and recommendation systems) . AI can improve people's wellbeing and health by increasing clinicians' diagnostic work, highlighting prevention options, and delivering tailored treatment suggestions on electronic health records (EHRs). I. INTRODUCTION:
 Despite the employment of several useful technologies in health care , AI is not widely deployed . As a result, AI, machine learning (ML) and deep learning (DL) algorithms continue to be mysterious in many cases . Decisionmaking processes are generally hard to explain. Moral and practical challenges arise. I. INTRODUCTION:
 Without understanding AI diagnoses, it is impossible to tell if diagnostic disparities between patients reflect diagnostically important variations or bias, diagnostic errors, or under/over-diagnosis. I. INTRODUCTION:
 A number of governmental and commercial organizations have recently released recommendations and guidelines for the appropriate use of AI in response to these issues. The study, however, reveals a considerable discrepancy in the alleged transparency characteristics. Many critical difficulties in medicine may be resolved with the use of AI. I. INTRODUCTION:
 Numerous cases have gained pace in recent years as a result of significant research on automated prognosis, diagnosis, testing, and medicine formulation . Along with genetic data, biosensors, and medical imaging, these sources create a large quantity of data . I. INTRODUCTION:
 A critical objective of AI in medicine is to personalize medical decisions, health practices, and medications for unique people. Nevertheless, the current state of AI in medicine has been described as ""strong on promise but rather lacking in evidence and demonstration"". I. INTRODUCTION:
 Real-world clinical settings have been tested to detect wrist fractures, diabetic retinopathy, cancer metastases, histologic breast, congenital cataracts, and colonic polyps; however, many of the systems that have been demonstrated to be equivalent to or superior to experts in experimental settings have demonstrated high false-positive rates in real-world clinical settings . I. INTRODUCTION:
 Additionally, prejudice, security, privacy, and a deficit of transparency exist, as do trust, fairness, informativeness, transferability, and causality . Numerous critical difficulties in medicine may be resolved with the use of AI . I. INTRODUCTION:
 Together with medical imaging, biosensors, genetic data, and electronic medical records, these sources create a large quantity of data . To make a precise diagnosis in precision medicine, doctors need substantially more information than a simple binary prediction . I. INTRODUCTION:
 ML in medicine has grown more concerned with explainability, interpretability, and openness . There is sufficient evidence that ML-based methods are helpful; however, their widespread adoption is unlikely until these issues are solved, most likely by providing systems with adequate explanations for their judgments ."
"Social Determinants of Health and Impact on Screening, Prevalence, and Management of Diabetic Retinopathy in Adults: A Narrative Review","https://scispace.com/paper/social-determinants-of-health-and-impact-on-screening-je7v75k4","2022","Journal Article","Stomatology","Dhruv Patel
Ajaykarthik Ananthakrishnan
Tyger Lin
Roomasa Channa
T. Y. Alvin Liu
Risa M. Wolf","10.3390/jcm11237120","https://scispace.com/pdf/social-determinants-of-health-and-impact-on-screening-je7v75k4.pdf","Diabetic retinal disease (DRD) is the leading cause of blindness among working-aged individuals with diabetes. In the United States, underserved and minority populations are disproportionately affected by diabetic retinopathy and other diabetes-related health outcomes. In this narrative review, we describe racial disparities in the prevalence and screening of diabetic retinopathy, as well as the wide-range of disparities associated with social determinants of health (SDOH), which include socioeconomic status, geography, health-care access, and education.","with lower average income, having government-provided insurance, and having lower visual acuity . Efforts to recruit study participants who are typically underrepresented can help determine the impact of new DR treatments in all people with diabetes, while promoting health and equity. Conclusions:
 As the prevalence of diabetes in the U.S. and worldwide continues to increase, as does the burden of diabetes-related complications, particularly diabetic retinopathy and macular edema, it is important to address inequities due to SDOH in the prevalence, screening, management, and outcomes of DRD. Lower socioeconomic status, household income, education, rural geography, and minority status are all associated with reduced access to diabetic retinopathy screening. Delays in diagnosis compounded with risk factors for diabetic retinopathy portends worse visual outcomes. Implementation of accessible DR screening programs using teleretinal networks or autonomous artificial intelligence-based screening in underserved and under-resourced rural and low-income areas can improve early detection of DR, thereby reducing poor visual outcomes in these communities. The diagnostic accuracy achievable by AI paired with its scalability has the potential to increase screening access and diagnosis, and mitigate disparities related to social determinants of health, provided that diagnosability, racial and ethnic bias, explainability, and data usage are adequate addressed in the development. Early detection and diagnosis of DR can also improve long-term visual outcomes for the millions of individuals with diabetes in the US. Although there have been significant advancements in the management of DRD, offering equitable therapies and optimizing adherence where disparities exist can help improve visual outcomes. Future research should aim to increase generalizability in clinical trials with a greater representation of minority populations in study cohorts, as well as the evaluation of visual outcomes further down the clinical pathway. Efforts to promote equity in diabetes clinical care should focus on mitigating care gaps related to social determinants of health to ensure optimal visual outcomes for all people with diabetes. Conclusions:
 There are limitations to this narrative review in that publications reviewed focused on the US health care system; therefore, they do not address global concerns around inequities and social determinants of health associated with diabetic retinopathy."
"Artificial intelligence and deep learning in ophthalmology - present and future (Review).","https://scispace.com/paper/artificial-intelligence-and-deep-learning-in-ophthalmology-37jk863ya2","2020","Journal Article","Experimental and Therapeutic Medicine","Andreea Moraru
Danut Costin
Radu Lucian Moraru
Daniel Constantin Branisteanu","10.3892/ETM.2020.9118","https://scispace.com/pdf/artificial-intelligence-and-deep-learning-in-ophthalmology-37jk863ya2.pdf","Since its introduction in 1959, artificial intelligence technology has evolved rapidly and helped benefit research, industries and medicine. Deep learning, as a process of artificial intelligence (AI) is used in ophthalmology for data analysis, segmentation, automated diagnosis and possible outcome predictions. The association of deep learning and optical coherence tomography (OCT) technologies has proven reliable for the detection of retinal diseases and improving the diagnostic performance of the eye's posterior segment diseases. This review explored the possibility of implementing and using AI in establishing the diagnosis of retinal disorders. The benefits and limitations of AI in the field of retinal disease medical management were investigated by analyzing the most recent literature data. Furthermore, the future trends of AI involvement in ophthalmology were analyzed, as AI will be part of the decision-making regarding the scientific investigation, diagnosis and therapeutic management.","obtained by deep learning assessment, or when a patient does not receive counseling related to the required treatment it is necessary to introduce and apply medicolegal and ethical regulations. Limitations: All these potential shortcomings highlight the need for continuous improvement in AI technology. The future:
 In the near future, AI will become more involved in the decision-making regarding the scientific investigation, diagnosis and therapeutic management. Tele-ophthalmology applications can transmit information to less developed regions that face a shortage of specialists . Already, a hybrid algorithm, with high sensitivity and specificity, named IDx-DR, approved by FDA as a low to moderate risk device, is used for diabetic retinopathy screening, aiding the management of patients that need referral to an ophthalmologist. AI can quickly analyze large databases. Based on these analyzes, AI can explore the associations between disease features that may not be easily obvious to humans. The future:
 The clinical analysis of the ophthalmologist supported by the DL analysis results will improve the individualization of the medical management, for the benefit of the patients . The future:
 AI also plays an important role in scientific research. With the help of AI, the features of newly discovered eye diseases can be identified . It is expected that AI algorithms will help in identifying new biomarkers, specific to each disease, as they are able to search for characteristics themselves and are not limited to only recognizing clinical features. The future:
 Ongoing research aims to develop autonomous software able to diagnose simultaneously AMD, diabetic retinopathy and glaucoma, predict progression and recommend personalized treatment. Conclusions:
 AI/ DL (deep learning) algorithms using both OCT and fundus will revolutionize techniques and methodologies of image analysis. Optimizing these (combined) technologies will accelerate the progress in this area. Currently, there are software programs that standardize OCT images from various devices and the results of these software packages are comparable when the appropriate metrics are used consistently. Nevertheless, large databases, using real patient data, are required to optimize the performance of this type of analysis. Thus, computer-assisted screening, diagnosis and prediction of the ophthalmic disease will reach new frontiers. Conclusions:
 In ophthalmology AI has the potential to increase patient access to clinical screening/diagnosis and decrease health-care costs, especially when the risk of the disease occurrence is high or the communities confront with low financial resources. However, legal regulations and solving of the reproducibility issues are required before AI based screening is incorporated in clinical practice."
"Artificial Intelligence in Medicine: A New Way to Diagnose and Treat Disease","https://scispace.com/paper/artificial-intelligence-in-medicine-a-new-way-to-diagnose-5e8bx4kpan","2023","Repository","","A.S.Hovan George
Aakifa Shahul
Dr.A.Shaji George","10.5281/zenodo.8374066","https://scispace.compdf/artificial-intelligence-in-medicine-a-new-way-to-diagnose-5e8bx4kpan.pdf","","Treatment: Researchers have developed AI models that exceed the diagnostic performance of ophthalmologists, radiologists, pathologists, and cardiologists in assessing conditions like diabetic retinopathy, cancer, heart disease, and pneumonia based on imaging scans and patient data. CONCLUSION 5.1 Summary of How AI is Transforming Medical Diagnosis and Treatment:
 Systems like Arterys' cardiac MR analysis AI tool and IDx's diabetic retinopathy diagnostic system have received FDA approval based on their high sensitivity and specificity. CONCLUSION 5.1 Summary of How AI is Transforming Medical Diagnosis and Treatment:
 Powered by techniques like deep learning and natural language processing, AI's pattern recognition capabilities allow it to find subtle clues that lead to earlier diagnoses and disease discoveries. AI algorithms surfaced cardiac risk factors hidden in patient files that preventable heart attacks. CONCLUSION 5.1 Summary of How AI is Transforming Medical Diagnosis and Treatment:
 AI is also making advances in predicting onset of diabetes, cancers, neurodegenerative diseases, and adverse health events. By expediting diagnosis, AI enables earlier intervention which dramatically improves prognosis. CONCLUSION 5.1 Summary of How AI is Transforming Medical Diagnosis and Treatment:
 Beyond diagnosis, AI is bringing the promise of personalized medicine closer by using vast health datasets and computational techniques to determine which treatments have the highest probability of benefitting patients based on their clinical profiles. CONCLUSION 5.1 Summary of How AI is Transforming Medical Diagnosis and Treatment:
 Researchers have developed AI models that generate tailored treatment plans by analyzing patient genetics, biomarkers, microbiome patterns, past medication history, and demographics. Such AI systems are in development for optimal cancer therapy selection, antidepressant prescription, and cardiovascular disease management. CONCLUSION 5.1 Summary of How AI is Transforming Medical Diagnosis and Treatment:
 However, thoughtfully constructed ethics and governance frameworks are vital for AI implementation in medicine. Challenges around clinician acceptance, algorithmic biases, and data transparency must be overcome to fully realize AI's advantages. AI should be judiciously integrated to enhance physician capabilities rather than replace human expertise and judgment. CONCLUSION 5.1 Summary of How AI is Transforming Medical Diagnosis and Treatment:
 With responsible development, AI systems can be powerful partners in providing predictive, preventive, precise and participatory care to improve patient outcomes. The future of medicine lies in synergistically blending human and machine intelligence. Discussion of the Future Outlook for AI in Medicine and Final Predictions:
 The integration of artificial intelligence in healthcare is rapidly accelerating, poised to transform how diseases are diagnosed, treatments personalized, and care delivered in the coming decades. Driven by advancements in deep learning and neural networks, applied prudently, AI promises to provide data-driven insights that revolutionize medicine. Discussion of the Future Outlook for AI in Medicine and Final Predictions:
 In the near future, AI will likely become a standard tool used by clinicians across most medical specialties to enhance their capabilities. AI imaging analysis will be widely deployed to flag potential abnormalities, aiding workflow. Discussion of the Future Outlook for AI in Medicine and Final Predictions:
 Autonomous AI diagnostic tools will emerge to boost access, speed, and accuracy for certain conditions, though physician oversight will remain critical. Multimodal AI models that synthesize insights across genetics, images, lab tests, and clinical notes will enable more holistic diagnoses."
"The Lancet Global Health Commission on global eye health: Vision beyond 2020","https://scispace.com/paper/the-lancet-global-health-commission-on-global-eye-health-22i2wine","2022","Journal Article","","Catherine Dumas","10.25259/ihopejo_15_2021","https://scispace.com/pdf/the-lancet-global-health-commission-on-global-eye-health-22i2wine.pdf","","Health in several regions. An integrated mHealth system is also being scaled up in Pakistan, enabling community health workers to identify and refer people with eye health needs and increase vision testing and decision support in the community (appendix 2 p 14). Artificial intelligence:
 There is considerable interest in the potential of artificial intelligence and particularly deep learning in ophthalmology.  This interest is driven in high-income countries by challenges in managing high volume chronic conditions (age-related macular degeneration, diabetic retinopathy, and glaucoma). Deep learning is particularly suited to these conditions because their diagnosis and management is largely dependent on retinal photography (appendix 2 p 15) and optical coherence tomography (appendix 2 p 16). Artificial intelligence has many potential applications in eye health that could enhance delivery, optimise health system functioning, and lead to improved patient outcomes. Examples of potential uses that are in development include supporting point-of-care diagnostics,  surgical decision making (risk stratification),  or patient management and treatment.  The most likely early application in public health programmes will be in screening for diabetic retinopathy and retinopathy of prematurity.  Artificial intelligence solutions can possibly be integrated with electronic medical records to support administrative tasks such as identifying patients with a specific eye condition or at-risk patients.  Artificial intelligence can be used in clinical, epidemiological, and health system research to incorporate data on social determinants of health, identify at-risk patient populations, and help to prioritise scarce clinical resources.  This area presents an opportunity to address the link between poverty and blindness, and the need to promote equity in eye health.  Finally, artificial intelligence coupled with telemedicine and mHealth could help to reach populations with poor health system access, either because of geographical isolation or scarcity of human resources for eye health.  There is little information on implementing artificial intelligence in eye health delivery and even less on whether it could improve care or outcomes. Before deployment into routine clinical practice, artificial intelligence applications require external validation on data that were not previously used in algorithm development and should undergo rigorous safety and efficacy testing in prospective clinical studies. In 2018, IDx-DR was the first artificial intelligence screening product for diabetic retinopathy to obtain approval from the FDA, after demonstrating good diagnostic accuracy in a prospective trial  done in a real-world setting. Artificial intelligence:
 To assess the extent of translation-ready artificial intelligence (in use or soon to be in use), this Commission did a scoping review for publications related to artificial intelligence in eye health since 2015 to 2020 (appendix 1 p 71). We identified 1256 primary data reports, most (60%) focused on retinal imaging (20% diabetic retinopathy, 16% glaucoma, and 6% age-related macular degeneration). Only 12% of reports addressed conditions that affect the anterior segment and 1•5% were on childhood eye conditions. Most (90%), reported on artificial intelligence model development and internal validation. Of 113 reports on external validation or successful deployment in clinical settings, most were for retinal conditions (58%), facilitated by greater availability of images. Arguably, the greatest potential for artificial intelligence to contribute to advancing eye health would be to assist in case identification and health system efficiency, helping people with uncorrected refractive error and cataract access services, neither of which are currently well represented in artificial intelligence development platforms."
