"Paper Title","Paper Link","Publication Year","Publication Type","Publication Title","Author Names","DOI","PDF Link","Abstract","Relevant Excerpt"
"Artificial Intelligence Driving Diabetes Care","https://scispace.com/paper/artificial-intelligence-driving-diabetes-care-uhxavhcp","2023","Journal Article","","","10.56570/jimgs.v2i1.92","https://scispace.com/pdf/artificial-intelligence-driving-diabetes-care-uhxavhcp.pdf","Artificial intelligence (AI), a technology reshapinghealthcare, is used to investigate, gather data and drawconclusions from electronic medical records andimaging procedures. AI has been shown to aid inidentifying, categorizing, diagnosing, and managingdiabetic mellitus [1]. It will likely continue to do so witha clear understanding and the ability to find previouslyunidentified solutions [2]. AI has a role in diabeteshelping to anticipate the diagnosis, provide nutritionand exercise goals, monitor complications, and assistwith self-management [7]. We may now see themanagement of diabetes and other chronic diseasesfrom a new viewpoint thanks to the expanded use ofcontinuous glucose monitoring and the identification ofpatterns in glucose fluctuation known as glucosevariability [3]. It has paved the way for in-depthresearch into the many new factors that affectmanaging diabetes such as socio-economic factors,sleep, and activity [1,2]","Title: Artificial Intelligence Driving Diabetes Care Authors: Aishwarya Sadagopan Keywords: Artificial Intelligence, Diabetes, CGMS, Precision Medicine, Glucose Variability, Machine Learning, Diabetes Management Introduction:
 Artificial intelligence (AI), a technology reshaping healthcare, is used to investigate, gather data and draw conclusions from electronic medical records and imaging procedures. AI has been shown to aid in identifying, categorizing, diagnosing, and managing diabetic mellitus . It will likely continue to do so with a clear understanding and the ability to find previously unidentified solutions . AI has a role in diabetes helping to anticipate the diagnosis, provide nutrition and exercise goals, monitor complications, and assist with self-management . We may now see the management of diabetes and other chronic diseases from a new viewpoint thanks to the expanded use of continuous glucose monitoring and the identification of patterns in glucose fluctuation known as glucose variability . It has paved the way for in-depth research into the many new factors that affect managing diabetes such as socio-economic factors, sleep, and activity . Redefining Diabetes Care:
 With electronic medical data, artificial intelligence has allowed us to shape and address the necessary preventive treatment by understanding and predicting people at high risk of acquiring diabetes . The classification and accurate prediction of diabetes in an individual may change soon with the thorough Editorial densities. A non-invasive method of anticipating and diagnosing the illness is now possible thanks to more precise and defined imaging advancements . Recently there has been use of more CT, MRI imaging modalities are being used more when compared to traditional imaging modalities as it is able to provide more enhanced images showing more detail of metabolic function and coronary anatomy by using imaging like MR spectroscopy, 3D intravascular ultrasound, and optical coherence tomography . Conclusion::
 AI is being used as a therapeutic and instructional tool that is and will revolutionize how diseases are managed for years to come. Machine learning is a tool that carries strategic weightage by carrying detailed analytical data in different forms in addition to clinical care that has been revolutionary in the incorporation of precision medicine, whether with CGMS discovery and implementation or through advancements in imaging modalities to screen, manage complications of diabetes. Conclusion::
 To lessen diabetes disease burden and aid in reducing morbidity associated with diabetes, AI use has integrated diagnostic and therapeutic roles with use of thorough analysis and algorithms that only increase the accuracy of management in diabetes care while also filling in the gaps that were missed previously. Focusing on precision medicine practice and treatment has tailored new innovative treatment goals towards individuals' particular data and surveillance. It is inclined to focus on collaborative efforts that have proven incredibly strategic and is an advancement to medical practices that is taking precedence. Artificial intelligence is transforming how diabetes is understood and managed by way of making new analysis that has paved the way to new focus of precision medicine care. examination of multiple glucose levels and analysis of CGM readings . Predicting prediabetes and diabetes at an earlier stage in more patients using strict glycemic trends, risk factors, and focusing on adapting precision therapy may become a reality in primary care settings ."
"Medical AI and Contextual Bias","https://scispace.com/paper/medical-ai-and-contextual-bias-4fyt7p7ts5","2019","Posted Content","Social Science Research Network","Price
W. Nicholson","","https://scispace.com/pdf/medical-ai-and-contextual-bias-4fyt7p7ts5.pdf","Artificial intelligence will transform medicine. One particularly attractive possibility is the democratization of medical expertise. If black-box medical algorithms can be trained to match the performance of high-level human experts — to identify malignancies as well as trained radiologists, to diagnose diabetic retinopathy as well as board-certified ophthalmologists, or to recommend tumor-specific courses of treatment as well as top-ranked oncologists — then those algorithms could be deployed in medical settings where human experts are not available, and patients could benefit. 

But there is a problem with this vision. Privacy law, malpractice, insurance reimbursement, and FDA approval standards all encourage developers to train medical AI in high-resource contexts, such as academic medical centers. And put simply, care is different in high-resource settings than it is in low-resource settings such as community health centers or rural providers in less-developed countries. Patient populations differ, as do the resources available to administer treatment and the resources available to pay for that treatment. This development pattern will lead to decreases in the quality of the algorithm’s recommendations, reflected in problematic care and increased costs. Perniciously, such quality problems in low-resource contexts are likely to go unrecognized for exactly the same reasons that promote algorithmic training in high-resource contexts.

Solutions are not trivial. Labeling products the same way that drugs are labeled is unlikely to work, and truly addressing the problem may require a combination of public investment in data to train medical AI and regulatory requirements for cross-context validation. Nevertheless, if black-box medicine is to achieve its goal of bringing excellent medicine to broad sets of patients, the problem of contextual bias should be recognized and addressed sooner rather than later.","improve privacy as details are read by machines rather than medical scribes. B. Automating the Routine: (finding that physicians ""logged an average of 3.08 hours on office visits and 3.17 hours on desktop medicine each day""). C. Democratizing Expertise:
 Finally, medical AI promises to democratize medical expertise. Today, there are tremendous differences in the quality and level of care patients receive based on the context in which they receive that care.  This is reflected in everything from the availability of a specialist (e.g., whether a patient can see a board-certified ophthalmologist or dermatologist rather than relying on a primary care physician for more complex care) to the type of practitioner involved (e.g., physician versus nurse practitioner) to the qualifications of the provider (e.g., top-of-her-class with elite fellowships to less-exalted qualifications).  Medical AI promises to reduce this variation by ""leveling up""allowing a much broader swath of providers to provide care at the level of excellent specialists, which is what I mean by democratization of medical expertise. Medical AI is scalable in a way that human expertise simply is not; although gathering data, training algorithms, and validating algorithmic performance are all hard and expensive tasks, 30 duplicating an existing algorithm for use in another setting is much easier and cheaper than training new people for the same tasks. 31 It's not free or easyinformation infrastructure still needs to be set up,  and the data the algorithm will analyze need to be properly collected and formatted on-site 33but an algorithm is easier to copy than an oncologist. C. Democratizing Expertise:
 This Section describes how AI can democratize different types of medical expertise. It then considers where AI can bring expertisea span that ranges from other high-resource settings like mid-level hos- 31. Such duplication is not costless, of course, and in some situations doing the transfer right might actually be more expensive than home-growing a solution. See, e.g., JAMES E. TCHENG ET AL., NAT'L ACAD. OF MED., OPTIMIZING STRATEGIES FOR CLINICAL DECISION SUPPORT: SUMMARY OF A MEETING SERIES 28 (2017) (""While the creation of CDS [clinical decision support] content in-house is an expensive and resource-intensive endeavor, sharing CDS content, either with peers or through the licensing of vendor content, is presently perceived to be equally or more expensive; thus this duplication of effort at each site has persisted.""). 33. Further down the road, AI can help here too; natural language processing will make it easier to accept unstructured data about patients rather than requiring data to be in a certain format. See supra Section II.B. pitals to very low-resource settings like rural providers in lessdeveloped countries. Diagnostics and Treatment Recommendations:
 AI can democratize different types of medical expertise. Though medical expertise comes in many flavors, with many interconnections, we can usefully consider two rough classes: diagnostics and treatment recommendations."
"Artificial Intelligence and Diabetes Mellitus: An Inside Look Through the Retina","https://scispace.com/paper/artificial-intelligence-and-diabetes-mellitus-an-inside-look-rryef32ofg","2024","Journal Article","arXiv.org","Yasin Sadeghi Bazargani
Majid Mirzaei
Navid Sobhi
M. Abdollahi
A. Jafarizadeh
Siamak Pedrammehr
Roohallah Alizadehsani
Ru-San Tan
Sheikh Mohammad Shariful Islam
U. R. Acharya","10.48550/arxiv.2402.18600","https://scispace.compdf/artificial-intelligence-and-diabetes-mellitus-an-inside-look-rryef32ofg.pdf","Diabetes mellitus (DM) increases the risk of vascular complications, and retinal vasculature imaging serves as a valuable indicator of both microvascular and macrovascular health. Moreover, artificial intelligence (AI)-enabled systems developed for high-throughput detection of diabetic retinopathy (DR) using digitized retinal images have become clinically adopted. This study reviews AI applications using retinal images for DM-related complications, highlighting advancements beyond DR screening, diagnosis, and prognosis, and addresses implementation challenges, such as ethics, data privacy, equitable access, and explainability. We conducted a thorough literature search across several databases, including PubMed, Scopus, and Web of Science, focusing on studies involving diabetes, the retina, and artificial intelligence. We reviewed the original research based on their methodology, AI algorithms, data processing techniques, and validation procedures to ensure a detailed analysis of AI applications in diabetic retinal imaging. Retinal images can be used to diagnose DM complications including DR, neuropathy, nephropathy, and atherosclerotic cardiovascular disease, as well as to predict the risk of cardiovascular events. Beyond DR screening, AI integration also offers significant potential to address the challenges in the comprehensive care of patients with DM. With the ability to evaluate the patient’s health status in relation to DM complications as well as risk prognostication of future cardiovascular complications, AI-assisted retinal image analysis has the potential to become a central tool for modern personalized medicine in patients with DM.","OCT and various clinical parameters. Conclusion: AI's capacity to assess a patient's health about DM complications and to forecast the risk of future complications positions AI-assisted retinal image analysis as a potentially key component in personalized medicine for individuals with DM. Ethics approval and consent to participate::
 This study was conducted under the principles outlined in the Declaration of Helsinki."
"Second-Generation Digital Health Platforms: Placing the Patient at the Center and Focusing on Clinical Outcomes.","https://scispace.com/paper/second-generation-digital-health-platforms-placing-the-101dooeye2","2020","Journal Article","","Yaron Ilan","10.3389/FDGTH.2020.569178","https://scispace.com/pdf/second-generation-digital-health-platforms-placing-the-101dooeye2.pdf","Artificial intelligence (AI) digital health systems have drawn much attention over the last decade. However, their implementation into medical practice occurs at a much slower pace than expected. This paper reviews some of the achievements of first-generation AI systems, and the barriers facing their implementation into medical practice. The development of second-generation AI systems is discussed with a focus on overcoming some of these obstacles. Second-generation systems are aimed at focusing on a single subject and on improving patients' clinical outcomes. A personalized closed-loop system designed to improve end-organ function and the patient's response to chronic therapies is presented. The system introduces a platform which implements a personalized therapeutic regimen and introduces quantifiable individualized-variability patterns into its algorithm. The platform is designed to achieve a clinically meaningful endpoint by ensuring that chronic therapies will have sustainable effect while overcoming compensatory mechanisms associated with disease progression and drug resistance. Second-generation systems are expected to assist patients and providers in adopting and implementing of these systems into everyday care.","variability, complex systems AI, artificial intelligence, EMR, electronic medical records, ML, machine learning, RCT, randomized controlled trials, NLP, natural language processing, TNF, tumor necrosis alpha, ConA, concanavalin A INTRODUCTION:
 The use of artificial intelligence (AI)-based systems in medicine has drawn much attention over the last decade . However, high expectations have not always been met by reality. Various obstacles have arisen, blocking AI platforms' validation and implementation . AI-based algorithm applications have been slower to spread in medical practice than anticipated. Obstacles include difficulty in achieving adequate algorithm stability, mainly due to difficulties associated with big data analysis, and also the failure of these methods to contribute to noteworthy clinical effects. The need for improved clinical outcomes, is a barrier to the adoption of AI by patients and healthcare providers . INTRODUCTION:
 The AI ""quadruple aim"" of improving care, improving overall population health, reducing healthcare costs, and improving the work life of healthcare providers, is still an unreachable environmental measures. The algorithms are largely designed to tailor their outputs on an individual basis . INTRODUCTION:
 A relatively limited number of settings in clinical practice currently benefit from the application of first-generation systems. A review of 450 published AI articles highlighted four areas: risk stratification of populations at risk, clinical decision support, disease screening, and tools for patient self-management . First-generation AI can reduce variations in clinical practice, improve efficacy and reduce medical errors . It has shown advantages when extracting and analyzing a large volume of data from EMR , developing risk scores , predicting mortality, readmission risks, prolonged length of stay, and failure to attend appointments , and for summarizing doctorpatient consultations . INTRODUCTION:
 First-generation systems have also been found useful for detection of atrial fibrillation and epilepsy seizures . These methods also showed some degree of success when interpreting phenotype and genomic data for genomics-based diagnosis , and for assessment of cancer risk . Benefits were also documented for identifying cancerous skin lesions , diagnosing cancer in computational histopathology , interpreting retinal imaging , detecting arrhythmias , polyp detection from colonoscopy , identifying genetic conditions from facial appearance , predicting acute kidney injury , detecting epilepsy , process images from endoscopy , and predicting outcomes of gastrointestinal bleeding . Some advantages were likewise shown for decision making in sepsis management , and in pharmacogenomics . Even self-monitoring of blood glucose can be facilitated by AI , helping to improve blood glucose control, reduce hypoglycemic episodes, and reduce diabetes-related complications . The resulting ""do it yourself "" automated insulin delivery for diabetics exemplifies democratization of medicine by providing privacy, intelligent computing, and sharing of information ."
"Novel artificial intelligence algorithms for diabetic retinopathy and diabetic macular edema","https://scispace.com/paper/novel-artificial-intelligence-algorithms-for-diabetic-3nndl62ekr","2024","Journal Article","Eye and vision","Jie Yao
Joshua Lim
Gilbert Lim
Jasmine Chiat Ling Ong
Yuhe Ke
Ting Fang Tan
Tien‐En Tan
Stela Vujosevic
Daniel Shu Wei Ting","10.1186/s40662-024-00389-y","https://scispace.compdf/novel-artificial-intelligence-algorithms-for-diabetic-3nndl62ekr.pdf","Abstract Background Diabetic retinopathy (DR) and diabetic macular edema (DME) are major causes of visual impairment that challenge global vision health. New strategies are needed to tackle these growing global health problems, and the integration of artificial intelligence (AI) into ophthalmology has the potential to revolutionize DR and DME management to meet these challenges. Main text This review discusses the latest AI-driven methodologies in the context of DR and DME in terms of disease identification, patient-specific disease profiling, and short-term and long-term management. This includes current screening and diagnostic systems and their real-world implementation, lesion detection and analysis, disease progression prediction, and treatment response models. It also highlights the technical advancements that have been made in these areas. Despite these advancements, there are obstacles to the widespread adoption of these technologies in clinical settings, including regulatory and privacy concerns, the need for extensive validation, and integration with existing healthcare systems. We also explore the disparity between the potential of AI models and their actual effectiveness in real-world applications. Conclusion AI has the potential to revolutionize the management of DR and DME, offering more efficient and precise tools for healthcare professionals. However, overcoming challenges in deployment, regulatory compliance, and patient privacy is essential for these technologies to realize their full potential. Future research should aim to bridge the gap between technological innovation and clinical application, ensuring AI tools integrate seamlessly into healthcare workflows to enhance patient outcomes. ","privacy and security of patient data is critical . Current challenges and future direction: Furthermore, the 'black box' nature of some AI algorithms, which do not readily reveal how decisions are made, raises ethical questions about transparency and accountability in patient care decisions . Current challenges and future direction:
 Another challenge is navigating the regulatory landscape. AI applications in healthcare should undergo rigorous regulatory review, ensuring they adhere to the highest standards of safety and efficacy . Current challenges and future direction:
 For AI tools targeting DR and DME, this means undergoing rigorous clinical trials and validation studies to satisfy the requirements of regulatory bodies like the Food and Drug Administration (FDA). Current challenges and future direction:
 However, the dynamic nature of AI and the uncertainty in defining the responsibility of AI poses unique challenges for regulatory approval. Current challenges and future direction:
 Moreover, the integration of AI into clinical settings also faces practical challenges, such as healthcare staff 's bias against new AI methods, and uncertainty of how the AI tools should be integrated into clinical work for healthcare professionals unfamiliar with AI . Current challenges and future direction:
 Addressing these issues requires comprehensive training programs and initiatives to demonstrate the tangible benefits of AI in enhancing patient care. Additionally, the varied applications of AI tools in clinical settings can influence their cost-effectiveness, presenting another obstacle to their real-world implementation . Current challenges and future direction:
 To bridge the gap between evidence and clinical implementation, a comprehensive approach is needed. This includes promoting closer collaboration between AI developers, regulatory bodies, and healthcare professionals to streamline the approval process and ensure AI tools meet clinical needs. Current challenges and future direction:
 Developing clear guidelines and standards for AI in healthcare, alongside robust training programs for healthcare providers, can also accelerate adoption. Current challenges and future direction:
 Additionally, addressing ethical and privacy concerns through transparent AI algorithms, stringent data protection measures, and promoting the use of generative training data will be crucial in gaining public trust and acceptance. Conclusion:
 The development of novel AI algorithms has tremendous transformative potential in the management of DR and DME. These state-of-the-art algorithms have the potential to enhance accuracy in screening, triage, and diagnosis and also allow for AI-driven precision medicine by enabling longitudinal prediction of disease progression and recommending tailored interventions. Conclusion:
 As DR screening systems advance and are progressively implemented in real-world settings, transition of burden from primary care to specialized medical facilities is expected. Consequently, there is a pressing need for tertiary care clinicians to arm themselves with higher efficiency AI tools. Conclusion:
 Moving forward, future DR and DME AI research endeavors should focus on a unified and thorough regulatory framework that ensures effectiveness and safety in a broad range of real-world contexts through proper deployment methods. Conclusion:
 This involves refining patient evaluations, offering more precise prognostic predictions, improving risk stratification, and providing personalized recommendations for follow-up care and treatment. Embracing AI-based precision medicine is essential in addressing the escalating global burden of DR and DME."
