"Paper Title","Paper Link","Publication Year","Publication Type","Publication Title","Author Names","DOI","PDF Link","Abstract","Relevant Excerpt"
"To AI or not to AI – when will the medical e-revolution come around?","https://scispace.com/paper/to-ai-or-not-to-ai-when-will-the-medical-e-revolution-come-4sav10mla4","2018","Journal Article","European Journal for Person Centered Healthcare","Lars-Petter Granan","10.5750/EJPCH.V6I2.1573","https://scispace.com/pdf/to-ai-or-not-to-ai-when-will-the-medical-e-revolution-come-4sav10mla4.pdf","Over the last few years, there has been an increasing interest in precision medicine and artificial intelligence (AI) and the jungle of methods they entail. Reading articles in different media even the highest ranking medical journals it is easy to get the impression that this is powerful stuff; the future is promising and the real challenge is if computers (and robots) will turn out morally sound or not, or even turn against their human creators. In the field of medicine, some understand this as a saviour and that computer algorithms, such as those represented by Google’s AlphaGo Zero and IBM’s Watson, are the future diagnosticians and maybe even clinicians. However, there is a huge catch to this optimistic (or frightening) worldview. The catch is usually omitted, or barely touched upon in these articles. These systems are dependent on information and often lots of information (e.g., Big Data). Nevertheless, the systems outcomes will, still, never be better than their inputs. If their inputs are flooded with noise and unstructured and unspecified variables, it will be increasingly difficult for the systems to disentangle the true underlying patterns. In clinical medicine, structured and standardized data are rare. Having an entire electronic medical record (EMR) in this structured and standardized way is even rarer. Thus, developing diagnostic or treatment algorithms based on these records might seem futile, especially for those colleagues who believe that natural language processing (NLP) will solve this problem. Here, it should be remembered that EMR is a cornucopia of noisy text and language specific challenges for most countries in the world. Nevertheless, we should of course acknowledge those diagnostic tools that have already been developed, based largely on “visual” pattern recognition in, for instance, pathology [1]. Precision medicine, algorithms and complex dynamic and adaptive systems","Title: To AI or not to AI -when will the medical e-revolution come around? Authors: Lars-Petter Granan (Corresponding Author) Keywords: Artificial Intelligence (AI), co-morbidity, complex adaptive systems, diagnostic and treatment algorithms, electronic medical record (EMR), person-centered healthcare, precision medicine, preferences, robotics, systems outcomes, values Introduction:
 Over the last few years, there has been an increasing interest in precision medicine and artificial intelligence (AI) and the jungle of methods they entail. Reading articles in different media -even the highest ranking medical journals -it is easy to get the impression that this is powerful stuff; the future is promising and the real challenge is if computers (and robots) will turn out morally sound or not, or even turn against their human creators. In the field of medicine, some understand this as a saviour and that computer algorithms, such as those represented by Google's AlphaGo Zero and IBM's Watson, are the future diagnosticians and maybe even clinicians. However, there is a huge catch to this optimistic (or frightening) worldview. Introduction:
 The catch is usually omitted, or barely touched upon in these articles. These systems are dependent on information -and often lots of information (e.g., Big Data). Nevertheless, the systems outcomes will, still, never be better than their inputs. If their inputs are flooded with noise and unstructured and unspecified variables, it will be increasingly difficult for the systems to disentangle the true underlying patterns. In clinical medicine, structured and standardized data are rare. Having an entire electronic medical record (EMR) in this structured and standardized way is even rarer. Thus, developing diagnostic or treatment algorithms based on these records might seem futile, especially for those colleagues who believe that natural language processing (NLP) will solve this problem. Here, it should be remembered that EMR is a cornucopia of noisy text and language specific challenges for most countries in the world. Nevertheless, we should of course acknowledge those diagnostic tools that have already been developed, based largely on ""visual"" pattern recognition in, for instance, pathology . Precision medicine, algorithms and complex dynamic and adaptive systems:
 Based on these fundamental limitations, the near future of systems medicine or precision medicine is very bleak and limited. For sure, a few researchers and authors stand out as more reflective than others. A recent article by Manrai, Patel and Ioannidis  portrayed the future of precision medicine as even gloomier. These authors highlight the problem with one of the seemingly most standardized and structured data variables, references in laboratory tests. In addition, Mentis and co-workers  point out the possible threat of precision medicine to global health. They emphasize the dangers of ""placing too much emphasis on algorithms and not taking the patient's complex background and needs, such as culture, values, preferences, and beliefs, into consideration"" . In theory, at least, having algorithms analyzing structured and standardized complete EMRs from both small local hospitals, large university hospitals, and including the findings from general practice, rehabilitation institutions and nursing homes (among others), would address the effectiveness of much of our healthcare services from individual conditions to public health issues."
"The Scope and Applications of Artificial Intelligence in the Medical Sector","https://scispace.com/paper/the-scope-and-applications-of-artificial-intelligence-in-the-54alz0u7gq","2021","","","Madhuri Kumar Mr
John Alen Mr","10.53759/0088/JBSHA202101003","https://scispace.com/pdf/the-scope-and-applications-of-artificial-intelligence-in-the-54alz0u7gq.pdf","","responding to questions regarding drugs and when signs warrant a doctor consultation. The National Institutes of Health (NIH) developed the AiCure App, which uses smartphones webcams accessibility to check a client's medicine use and thereby minimize non adherence levels. Fig 2. AI application within the healthcare sector:
 Fitbit, Apple, and other wellness monitors can detect heartbeat, exercise habits, and sleeping patterns, and some have even added ECG reconstructions to their offerings. All of these new advancements can notify the user to any changes and Healthcare diagnostics:
 provide the physician with a greater understanding of the specific patient. The Netherlands employs artificial intelligence to analyze its health system, finding therapeutic errors and inconsistencies in order to reduce avoidable hospitalization . Aside from existing innovations, several advancements are in different stages of exploration that will assist doctors in becoming general practitioners. IBM's Watson Healthcare is a good illustration of this, as it will be able to detect heart problems and tumor indications quickly. A system for Intelligence healthcare is being developed at Stanford University (PAC). Through the use of many detectors, PAC has developed a sophisticated senior well-being assistance system and sophisticated ICUs that will detect any behaviour change in older adults residing independently and ICU victims. Smart Handwashing Assistance and Health insurance Conversation Interfaces are two other initiatives that PAC is working on. Healthcare diagnostics:
 Depth detectors and computational vision technologies are being used to provide ideal hand washing for physicians and nurses' personnel, minimizing healthcare associated infections. Medical conversation initiatives examine how Siri, Google Now, S voice, and Cortana responds to queries from portable device users about mental wellbeing, antisocial behaviour, and physical wellbeing, enabling individuals to access treatment sooner. Molly is a computerized nurse who will give follow-up treatment to released individuals, enabling physicians to concentrate on more urgent problems. In the future, AI will play a significant role in medicine. As a result, it is critical to educate the next generation of medical students about the principles and applications of AI, as well as how to operate effectively in a workplace alongside robots for increased efficiency, while also developing soft skills such as empathy."
"Exploring perceptions of healthcare technologies enabled by artificial intelligence: an online, scenario-based survey.","https://scispace.com/paper/exploring-perceptions-of-healthcare-technologies-enabled-by-46wbbucck5","2021","Journal Article","BMC Medical Informatics and Decision Making","Alison L. Antes
Sara Burrous
Bryan A. Sisk
Matthew J. Schuelke
Jason D. Keune
James M. DuBois","10.1186/S12911-021-01586-8","https://scispace.com/pdf/exploring-perceptions-of-healthcare-technologies-enabled-by-46wbbucck5.pdf","Healthcare is expected to increasingly integrate technologies enabled by artificial intelligence (AI) into patient care. Understanding perceptions of these tools is essential to successful development and adoption. This exploratory study gauged participants’ level of openness, concern, and perceived benefit associated with AI-driven healthcare technologies. We also explored socio-demographic, health-related, and psychosocial correlates of these perceptions. We developed a measure depicting six AI-driven technologies that either diagnose, predict, or suggest treatment. We administered the measure via an online survey to adults (N = 936) in the United States using MTurk, a crowdsourcing platform. Participants indicated their level of openness to using the AI technology in the healthcare scenario. Items reflecting potential concerns and benefits associated with each technology accompanied the scenarios. Participants rated the extent that the statements of concerns and benefits influenced their perception of favorability toward the technology. Participants completed measures of socio-demographics, health variables, and psychosocial variables such as trust in the healthcare system and trust in technology. Exploratory and confirmatory factor analyses of the concern and benefit items identified two factors representing overall level of concern and perceived benefit. Descriptive analyses examined levels of openness, concern, and perceived benefit. Correlational analyses explored associations of socio-demographic, health, and psychosocial variables with openness, concern, and benefit scores while multivariable regression models examined these relationships concurrently. Participants were moderately open to AI-driven healthcare technologies (M = 3.1/5.0 ± 0.9), but there was variation depending on the type of application, and the statements of concerns and benefits swayed views. Trust in the healthcare system and trust in technology were the strongest, most consistent correlates of openness, concern, and perceived benefit. Most other socio-demographic, health-related, and psychosocial variables were less strongly, or not, associated, but multivariable models indicated some personality characteristics (e.g., conscientiousness and agreeableness) and socio-demographics (e.g., full-time employment, age, sex, and race) were modestly related to perceptions. Participants’ openness appears tenuous, suggesting early promotion strategies and experiences with novel AI technologies may strongly influence views, especially if implementation of AI technologies increases or undermines trust. The exploratory nature of these findings warrants additional research.","technologies deliver a baby. However, a survey of patient satisfaction with a specific application of AI for diabetic retinopathy screening in Australia found that 96% of patients were satisfied or very satisfied with automated screenings, with convenience being particularly important to them . Introduction:
 In semi-structured interviews with dermatology patients in the United States (U.S.), the most common perceived advantages of AI were increased diagnostic speed, healthcare access, and diagnostic accuracy . However, patients also viewed the possibility of less accurate diagnosis to be the greatest potential disadvantage, and 94% of participants preferred human-AI partnership to AI alone. Another qualitative study of patients in the Netherlands regarding AI in radiology concluded that patients' knowledge is limited and education may be required to foster acceptance of AI and obtain patient input on implementation . A preliminary framework of patients' perspectives produced by the study indicated patients were concerned with efficiency, accountability, reliability, and the boundaries of technologies relative to human providers. Introduction:
 These prior studies did not assess openness or perceived concerns and benefits regarding AI technologies in healthcare among individuals in the U.S., or examine potential correlates that might help understand perceptions. The context and characteristics of the healthcare tasks enabled by AI may influence perceptions . Individuals may have different views of AI that enables diagnosis, treatment, or prognosis, and these views may especially depend on the seriousness, consequences, and complexity of the decision-making required . For example, individuals may respond differently to applications that diagnose or treat cancer versus a broken bone. Individuals may also hold different views related to AI-enabled technologies they might utilize at home-e.g., personalized health Apps and wearableswhereas they might prefer to engage with humans in the clinic or hospital. Further, whether the tools aim to promote wellness or provide treatment-e.g., reduce risk of heart disease versus treat heart disease-may influence perceptions. Introduction:
 In addition to perceptions potentially depending, at least in part, on task context and characteristics, individuals may perceive certain risks or benefits associated with AI-enabled technologies in healthcare. For example, the potential for AI to improve the efficiency and accuracy of decisions may be appealing, but the potential loss of professional discretion and individualized interactions may be concerning . Applications of AI in society generally have raised concerns about their potential to undermine fairness and further exacerbate inequities . A recent report from the National Academy of Medicine indicates that equity and inclusion must be prioritized when designing and scaling AI, as consumerfacing technologies in other domains have exacerbated longstanding inequities . Thus, individuals might perceive concerns related to social justice with the advent of AI-enabled tools in healthcare."
"Social, Technological and Health Innovation: Opportunities and Limitations for Social Policy, Health Policy, and Environmental Policy","https://scispace.com/paper/social-technological-and-health-innovation-opportunities-and-14t7rz65","2022","Book Chapter","","","10.3389/978-2-8325-0513-7","https://scispace.com/pdf/social-technological-and-health-innovation-opportunities-and-14t7rz65.pdf","","radiology . For instance, Arterys Cardio DL, the cloud analytics software recently approved by the U.S. Food and Drug Administration (FDA), helps interpret cardiac MRI, reduces the workload of radiologists, and thus significantly decreases the need for specialists . SHORT-TERM STRATEGIES FOR INNOVATION: THE CURRENT BIG IDEAS:
 How will these technologies be implemented in India? Consider a use-case scenario of the ""CheXNeXt"" algorithm . This CNN-based technology utilizes chest x-rays, the most common imaging tool across the world. Built by researchers at Stanford University, it has been proven to diagnose pneumonia in suspected cases better than radiologists of the same institution, historically long-considered one of the top-ten best radiology training centers in the US . India, on the other hand, with its immense burden of infectious diseases, sorely lacks radiologists, especially at primary and secondary healthcare centers. However, x-ray diagnostic facilities are often available at community health centers. Therefore, images taken here may be uploaded online for analysis by the algorithm resulting in guidance for the rural physician. This will allow rapid confirmation of the diagnosis in non-complex cases, the majority, by a basic medical doctor leading to an early start of empiric treatment and better patient outcomes. Such innovations, by radically reducing the number of specialists required, hold immense hope for healthcare delivery in the most remote villages. Technology here complements clinical competency, with the algorithm diagnosing the majority of cases and flagging the challenging ones for review and resolution by the expert. Thus, implementing CheXNeXt in a nation where over two-thirds live in villages can have a significant impact . Unfortunately, support for this technology was not available in the current pandemic in the majority of India, where doctors in rural areas could have benefitted by getting X-rays of suspected COVID-19 pneumonia cases evaluated by a radiologist or a counterpart. SHORT-TERM STRATEGIES FOR INNOVATION: THE CURRENT BIG IDEAS:
 Furthermore, as part of healthcare innovation, AI can not only diagnose disease under supervision as above; it has been proven to work without the need for a supervising doctor, in selected cases. This gains special relevance in a nation having one of the poorest physician (allopathic) to patient ratios worldwide. Consider IBM's Watson for Oncology, whose independent therapeutic decision-making for breast cancer cases had a 93% concordance with a multi-disciplinary tumor-board . Similarly, ""IDx Dr, "" the first FDA-approved AI-based diagnostic system for screening of diabetic retinopathy, also does not require an ophthalmologist for its operation . Thus, it is of value to secondary healthcare centers in inaccessible areas, in India, permitting them to screen a large number of diabetics . This is crucial for a country having over 70 million diabetics , and a current epidemic of retinopathy . Another work, published in 2020, promises similar significance by detecting fundal papilledema with over 96% sensitivity ."
"Enhancing Patient Communication and Health Literacy through AI-Enabled Services: A Pathway to Improved Patient Experience","https://scispace.com/paper/enhancing-patient-communication-and-health-literacy-through-euuin7fbzjlg","2025","Journal Article","International Journal For Multidisciplinary Research","Chetan Parmar","10.36948/ijfmr.2025.v07i05.55765","https://scispace.compdf/enhancing-patient-communication-and-health-literacy-through-euuin7fbzjlg.pdf","This research explores the impact of AI-driven services on improving the patient experience, emphasizing the quality of communication and health literacy. Employing a cross-sectional, quantitative method, information was gathered from 200 individuals in the Delhi/NCR area who had engaged with AI-driven healthcare technologies such as chatbots, virtual assistants, and mobile apps. The results indicate a statistically significant positive relationship between the utilization of AI-powered services and enhanced communication between patients and healthcare professionals (r = 0.536, p &lt; 0.01). Additionally, the research noted a moderate but significant relationship between AI-driven instructional resources and enhanced patient comprehension of health information (r = 0.376, p &lt; 0.01). These findings indicate that AI can enhance patient empowerment through timely, consistent, and easily accessible communication and educational materials. The research highlights the importance of combining AI tools with human-led assistance to enhance their effectiveness, particularly in boosting health literacy. The study finds that AI acts as an important addition to conventional care, improving patient satisfaction and aiding patient-focused healthcare delivery, especially in advancing digital healthcare systems. ","(AI) in healthcare, emphasizing its impact on redefining medical diagnostics, treatment, and delivery. The research revealed that AI technologies-spanning medical imaging and diagnostics to drug development, virtual health assistants, and remote monitoring-greatly enhanced patient care. Review of Literature:
 Imaging tools driven by AI enabled early disease identification, while predictive models sped up drug development and allowed for personalized treatments. Virtual assistants and chatbots improved patient interaction and accessibility, while remote monitoring systems facilitated ongoing health tracking and proactive care, decreasing hospital admissions. Review of Literature:
 Moreover, AI's predictive analytics facilitated tailored preventive approaches and public health initiatives. The authors sought to evaluate the present status of AI implementation via case studies, showcasing its effects on clinical practice and healthcare logistics. Review of Literature:
 They also tackled the ethical issues and barriers to implementation related to AI in healthcare, suggesting careful approaches to manage these challenges while optimizing AI's capabilities . Review of Literature:
 Oye (2022) explored the revolutionary effect of Artificial Intelligence (AI) in healthcare, emphasizing its ability to increase diagnostic precision, tailor treatments, and boost patient results. The research examined AI uses including predictive analytics, tailored medicine, virtual assistants, and administrative enhancement. Review of Literature:
 Utilizing machine learning and natural language processing, AI systems could examine extensive datasets, recognize patterns, and assist in clinical decision-making. These technologies enhanced diagnostic accuracy and operational effectiveness considerably. Review of Literature:
 The paper also tackled obstacles obstructing AI implementation, such as data quality problems, difficulties in system integration, professional pushback, and ethical issues like privacy, bias, and the necessity for human supervision. Review of Literature:
 Oye highlighted the significance of regulatory structures, collaboration among stakeholders, and ongoing innovation to guarantee the responsible and fair implementation of AI in healthcare. The results underscored the importance of collaborative approaches to completely unlock AI's capabilities in creating a more efficient, effective, and patient-focused healthcare system . Research Gap:
 The current research literature has established a solid recognition about the potential of Artificial Intelligence (AI) to impact the healthcare sector, including overall diagnostic accuracy (Oye, 2022; Jeyaraj & Narayanan, 2023), operational efficiency (Sharmila et al., 2024), and access to health care services . Research studies (e.g. Research Gap:
 medical imaging, predictive analytics, clinical decision support, and administrative efficiencies) in AI have showcased multiple applications. Papers have also referred to the use of virtual health assistants and AI chatbots to facilitate engagement for patients with providing tailored information . Research Gap:
 Despite these contributions being important, they are fundamentally technologies-centric, specifically looking at system capabilities, algorithm actions, and operational capacities. Research Gap:
 Nonetheless, there is a glaring omission in the literature on the patient-side experience, especially in terms of the quality of communication between patients and healthcare providers and the patients' understanding of health-related information once provided an AI-enabled service. Research Gap:
 The literature contains very few studies exploring AI effects on health literacy, that is, how well patients can understand, remember and apply medical advice given to them in an AI related service. Research Gap:
 While there has been some work to discuss patient engagement and access to AI-enabled health (Unanah & Aidoo, 2025), empirical studies researching AIenabled educational tools and how they positively impact healthcare and health outcomes -particularly in relation to non-clinical and everyday health management -are still developing."
